{
  "$schema": "https://json-schema.org/draft/2020-12/schema",
  "type": "object",
  "additionalProperties": false,
  "required": [
    "case_id",
    "instance",
    "llm_prompt",
    "reference"
  ],
  "properties": {
    "case_id": {
      "type": "string",
      "minLength": 1
    },
    "instance": {
      "type": "object"
    },
    "llm_prompt": {
      "type": "string",
      "minLength": 1
    },
    "reference": {
      "type": "object"
    }
  }
}
