{
  "case_id": "X2_MEMBER_2ed1647b5f12eb9f8a2a3c89",
  "instance": {
    "task_type": "X2",
    "slot_count": 320,
    "nodes": [
      0,
      1,
      2,
      3,
      4,
      5,
      6,
      7,
      8,
      9,
      10,
      11
    ],
    "directed_links": [
      {
        "link_id": 0,
        "source_node_id": 0,
        "destination_node_id": 1
      },
      {
        "link_id": 1,
        "source_node_id": 1,
        "destination_node_id": 0
      },
      {
        "link_id": 2,
        "source_node_id": 0,
        "destination_node_id": 11
      },
      {
        "link_id": 3,
        "source_node_id": 11,
        "destination_node_id": 0
      },
      {
        "link_id": 4,
        "source_node_id": 1,
        "destination_node_id": 5
      },
      {
        "link_id": 5,
        "source_node_id": 5,
        "destination_node_id": 1
      },
      {
        "link_id": 6,
        "source_node_id": 2,
        "destination_node_id": 3
      },
      {
        "link_id": 7,
        "source_node_id": 3,
        "destination_node_id": 2
      },
      {
        "link_id": 8,
        "source_node_id": 2,
        "destination_node_id": 10
      },
      {
        "link_id": 9,
        "source_node_id": 10,
        "destination_node_id": 2
      },
      {
        "link_id": 10,
        "source_node_id": 4,
        "destination_node_id": 5
      },
      {
        "link_id": 11,
        "source_node_id": 5,
        "destination_node_id": 4
      },
      {
        "link_id": 12,
        "source_node_id": 5,
        "destination_node_id": 6
      },
      {
        "link_id": 13,
        "source_node_id": 6,
        "destination_node_id": 5
      },
      {
        "link_id": 14,
        "source_node_id": 5,
        "destination_node_id": 7
      },
      {
        "link_id": 15,
        "source_node_id": 7,
        "destination_node_id": 5
      },
      {
        "link_id": 16,
        "source_node_id": 5,
        "destination_node_id": 8
      },
      {
        "link_id": 17,
        "source_node_id": 8,
        "destination_node_id": 5
      },
      {
        "link_id": 18,
        "source_node_id": 5,
        "destination_node_id": 9
      },
      {
        "link_id": 19,
        "source_node_id": 9,
        "destination_node_id": 5
      },
      {
        "link_id": 20,
        "source_node_id": 9,
        "destination_node_id": 10
      },
      {
        "link_id": 21,
        "source_node_id": 10,
        "destination_node_id": 9
      },
      {
        "link_id": 22,
        "source_node_id": 10,
        "destination_node_id": 11
      },
      {
        "link_id": 23,
        "source_node_id": 11,
        "destination_node_id": 10
      }
    ],
    "link_spectrum_states": [
      {
        "link_id": 0,
        "occupied_ranges": [
          [
            0,
            1
          ],
          [
            13,
            15
          ],
          [
            17,
            24
          ],
          [
            27,
            40
          ],
          [
            44,
            52
          ],
          [
            55,
            59
          ],
          [
            62,
            70
          ],
          [
            78,
            99
          ],
          [
            102,
            123
          ],
          [
            133,
            150
          ],
          [
            160,
            164
          ],
          [
            167,
            175
          ],
          [
            185,
            189
          ],
          [
            195,
            199
          ],
          [
            201,
            209
          ],
          [
            215,
            228
          ]
        ]
      },
      {
        "link_id": 1,
        "occupied_ranges": [
          [
            0,
            4
          ],
          [
            6,
            16
          ],
          [
            18,
            19
          ],
          [
            25,
            34
          ],
          [
            36,
            46
          ],
          [
            48,
            49
          ],
          [
            53,
            59
          ],
          [
            63,
            73
          ],
          [
            84,
            86
          ],
          [
            97,
            107
          ],
          [
            131,
            146
          ],
          [
            159,
            163
          ],
          [
            190,
            198
          ]
        ]
      },
      {
        "link_id": 2,
        "occupied_ranges": [
          [
            0,
            4
          ],
          [
            12,
            13
          ],
          [
            28,
            34
          ],
          [
            36,
            51
          ],
          [
            53,
            55
          ],
          [
            58,
            59
          ],
          [
            64,
            66
          ],
          [
            72,
            82
          ],
          [
            84,
            86
          ],
          [
            88,
            107
          ],
          [
            121,
            129
          ],
          [
            139,
            141
          ],
          [
            159,
            163
          ],
          [
            201,
            209
          ]
        ]
      },
      {
        "link_id": 3,
        "occupied_ranges": [
          [
            2,
            6
          ],
          [
            17,
            24
          ],
          [
            27,
            29
          ],
          [
            33,
            40
          ],
          [
            44,
            48
          ],
          [
            55,
            59
          ],
          [
            62,
            70
          ],
          [
            73,
            80
          ],
          [
            84,
            88
          ],
          [
            92,
            99
          ],
          [
            116,
            129
          ],
          [
            133,
            141
          ],
          [
            160,
            164
          ],
          [
            185,
            189
          ],
          [
            195,
            199
          ]
        ]
      },
      {
        "link_id": 4,
        "occupied_ranges": [
          [
            0,
            4
          ],
          [
            11,
            15
          ],
          [
            17,
            24
          ],
          [
            27,
            40
          ],
          [
            42,
            59
          ],
          [
            68,
            72
          ],
          [
            78,
            83
          ],
          [
            89,
            99
          ],
          [
            102,
            164
          ],
          [
            167,
            199
          ],
          [
            201,
            228
          ],
          [
            233,
            237
          ]
        ]
      },
      {
        "link_id": 5,
        "occupied_ranges": [
          [
            0,
            3
          ],
          [
            6,
            9
          ],
          [
            18,
            19
          ],
          [
            22,
            34
          ],
          [
            36,
            40
          ],
          [
            43,
            44
          ],
          [
            48,
            59
          ],
          [
            63,
            86
          ],
          [
            96,
            104
          ],
          [
            106,
            107
          ],
          [
            109,
            113
          ],
          [
            116,
            129
          ],
          [
            131,
            146
          ],
          [
            152,
            156
          ],
          [
            159,
            176
          ],
          [
            190,
            198
          ]
        ]
      },
      {
        "link_id": 6,
        "occupied_ranges": [
          [
            0,
            1
          ],
          [
            3,
            13
          ],
          [
            15,
            22
          ],
          [
            26,
            37
          ],
          [
            39,
            40
          ],
          [
            64,
            69
          ],
          [
            75,
            79
          ],
          [
            84,
            85
          ],
          [
            88,
            92
          ],
          [
            159,
            163
          ],
          [
            178,
            191
          ],
          [
            238,
            242
          ]
        ]
      },
      {
        "link_id": 7,
        "occupied_ranges": [
          [
            4,
            15
          ],
          [
            17,
            19
          ],
          [
            33,
            34
          ],
          [
            52,
            54
          ],
          [
            73,
            77
          ],
          [
            79,
            83
          ],
          [
            121,
            129
          ],
          [
            136,
            140
          ],
          [
            159,
            167
          ],
          [
            176,
            184
          ],
          [
            237,
            245
          ]
        ]
      },
      {
        "link_id": 8,
        "occupied_ranges": [
          [
            2,
            28
          ],
          [
            33,
            34
          ],
          [
            38,
            40
          ],
          [
            42,
            47
          ],
          [
            52,
            54
          ],
          [
            65,
            67
          ],
          [
            73,
            77
          ],
          [